{
  "archetype": "service",
  "sector": "prof",
  "company": "成都启元财税服务有限公司",
  "period": "2026-08",
  "today": "2026-09-17",
  "vatRate": 0.06,
  "citRate": 0.25,
  "profile": {
    "industry": "prof-accounting",
    "size": "21_50",
    "employees": 46,
    "rdStaff": 0,
    "province": "四川",
    "highTech": false,
    "exportRev12": 0,
    "unionFee12": 26000,
    "insuredStable": true,
    "trainingCert": 12
  },
  "sources": [
    {
      "id": "finance",
      "name": "财务软件 · 科目余额与凭证",
      "mode": "direct",
      "lastSync": "2026-09-17 07:30",
      "rows": 1284
    },
    {
      "id": "bank",
      "name": "银行流水 · 3 个账户",
      "mode": "import",
      "lastSync": "2026-09-17 07:00",
      "rows": 412
    },
    {
      "id": "invoice",
      "name": "发票数据 · 进销项",
      "mode": "direct",
      "lastSync": "2026-09-16 23:30",
      "rows": 356
    },
    {
      "id": "erp",
      "name": "ERP · 库存 / 应收应付 / 订单",
      "mode": "direct",
      "lastSync": "2026-09-17 07:30",
      "rows": 620
    },
    {
      "id": "payroll",
      "name": "工资表与社保",
      "mode": "import",
      "lastSync": "2026-09-11 18:00",
      "rows": 168
    }
  ],
  "ledger": {
    "months": [
      "2025-09",
      "2025-10",
      "2025-11",
      "2025-12",
      "2026-01",
      "2026-02",
      "2026-03",
      "2026-04",
      "2026-05",
      "2026-06",
      "2026-07",
      "2026-08"
    ],
    "pl": {
      "rev": [
        1260000,
        1310000,
        1290000,
        1420000,
        1680000,
        1120000,
        1380000,
        1460000,
        1510000,
        1440000,
        1390000,
        1360000
      ],
      "cogs": [
        680400,
        704780,
        699180,
        773900,
        890400,
        649600,
        756240,
        795700,
        828990,
        797760,
        778400,
        767040
      ],
      "sellExp": [
        93600,
        96600,
        95400,
        103200,
        118800,
        85200,
        100800,
        105600,
        108600,
        104400,
        101400,
        99600
      ],
      "adminExp": [
        227468,
        229530,
        229193,
        234648,
        242252,
        221308,
        232892,
        236274,
        238582,
        236540,
        234928,
        262332
      ],
      "rdExp": [
        0,
        0,
        0,
        0,
        0,
        0,
        0,
        0,
        0,
        0,
        0,
        0
      ],
      "finExp": [
        5283,
        5283,
        5283,
        5283,
        5283,
        5283,
        5283,
        5283,
        5283,
        5283,
        5283,
        -717
      ],
      "otherIncome": [
        0,
        0,
        0,
        0,
        0,
        0,
        0,
        0,
        0,
        0,
        0,
        0
      ],
      "taxSurcharge": [
        7560,
        7860,
        7740,
        8520,
        10080,
        6720,
        8280,
        8760,
        9060,
        8640,
        8340,
        8160
      ],
      "incomeTax": [
        61422,
        66487,
        63301,
        73612,
        103296,
        37972,
        69126,
        77096,
        79871,
        71844,
        65412,
        55896
      ],
      "detail": {
        "rent": [
          28000,
          28000,
          28000,
          28000,
          28000,
          28000,
          28000,
          28000,
          28000,
          28000,
          28000,
          56000
        ],
        "entertain": [
          7560,
          8122,
          8385,
          9940,
          9744,
          5600,
          9384,
          10366,
          11174,
          11232,
          11120,
          11424
        ],
        "dep": [
          9000,
          9000,
          9000,
          9000,
          9000,
          9000,
          9000,
          9000,
          9000,
          9000,
          9000,
          9000
        ],
        "interest": [
          2083,
          2083,
          2083,
          2083,
          2083,
          2083,
          2083,
          2083,
          2083,
          2083,
          2083,
          2083
        ],
        "fees": [
          3200,
          3200,
          3200,
          3200,
          3200,
          3200,
          3200,
          3200,
          3200,
          3200,
          3200,
          -2800
        ],
        "wages": [
          520000,
          520000,
          520000,
          520000,
          520000,
          520000,
          520000,
          520000,
          520000,
          520000,
          520000,
          520000
        ],
        "social": [
          89232,
          89232,
          89232,
          89232,
          89232,
          89232,
          89232,
          89232,
          89232,
          89232,
          89232,
          89232
        ],
        "prodLabor": [
          456924,
          456924,
          456924,
          456924,
          456924,
          456924,
          456924,
          456924,
          456924,
          456924,
          456924,
          456924
        ],
        "material": [
          216276,
          240656,
          235056,
          309776,
          426276,
          185476,
          292116,
          331576,
          364866,
          333636,
          314276,
          302916
        ]
      }
    },
    "bs": {
      "cash": [
        980000,
        1237104,
        1418467,
        1579200,
        1777444,
        2092187,
        2199268,
        2421563,
        2618732,
        2835424,
        3013184,
        3163850,
        3245725
      ],
      "ar": [
        1860000,
        1880000,
        1920000,
        1960000,
        2010000,
        2060000,
        1980000,
        2020000,
        2080000,
        2120000,
        2160000,
        2210000,
        2298000
      ],
      "inventory": [
        0,
        0,
        0,
        0,
        0,
        0,
        0,
        0,
        0,
        0,
        0,
        0,
        0
      ],
      "prepaid": [
        60000,
        60000,
        60000,
        60000,
        60000,
        60000,
        60000,
        60000,
        60000,
        60000,
        60000,
        60000,
        60000
      ],
      "fixedGross": [
        780000,
        780000,
        780000,
        780000,
        780000,
        780000,
        780000,
        780000,
        780000,
        780000,
        780000,
        780000,
        780000
      ],
      "accumDep": [
        410000,
        419000,
        428000,
        437000,
        446000,
        455000,
        464000,
        473000,
        482000,
        491000,
        500000,
        509000,
        518000
      ],
      "ap": [
        210000,
        214000,
        220000,
        226000,
        230000,
        236000,
        228000,
        232000,
        238000,
        242000,
        246000,
        250000,
        254000
      ],
      "wagesPayable": [
        609000,
        609232,
        609232,
        609232,
        609232,
        609232,
        609232,
        609232,
        609232,
        609232,
        609232,
        609232,
        609232
      ],
      "taxesPayable": [
        52000,
        131605,
        138508,
        134338,
        148745,
        188599,
        100763,
        142679,
        153561,
        157639,
        146866,
        138295,
        127481
      ],
      "shortLoan": [
        500000,
        500000,
        500000,
        500000,
        500000,
        500000,
        500000,
        500000,
        500000,
        500000,
        500000,
        500000,
        500000
      ],
      "longLoan": [
        0,
        0,
        0,
        0,
        0,
        0,
        0,
        0,
        0,
        0,
        0,
        0,
        0
      ],
      "paidIn": [
        2000000,
        2000000,
        2000000,
        2000000,
        2000000,
        2000000,
        2000000,
        2000000,
        2000000,
        2000000,
        2000000,
        2000000,
        2000000
      ],
      "retained": [
        -101000,
        83267,
        282727,
        472630,
        693467,
        1003356,
        1117273,
        1324652,
        1555939,
        1795553,
        2011086,
        2207323,
        2375012
      ]
    },
    "flows": {
      "collections": [
        1315600,
        1348600,
        1327400,
        1455200,
        1730800,
        1267200,
        1422800,
        1487600,
        1560600,
        1486400,
        1423400,
        1353600
      ],
      "purchases": [
        216276,
        240656,
        235056,
        309776,
        426276,
        185476,
        292116,
        331576,
        364866,
        333636,
        314276,
        302916
      ],
      "payments": [
        225253,
        249095,
        243159,
        324363,
        445853,
        204605,
        305643,
        345471,
        382758,
        349654,
        329133,
        317091
      ],
      "wagesPaid": [
        609000,
        609232,
        609232,
        609232,
        609232,
        609232,
        609232,
        609232,
        609232,
        609232,
        609232,
        609232
      ],
      "taxPaid": [
        52000,
        131605,
        138508,
        134338,
        148745,
        188599,
        100763,
        142679,
        153561,
        157639,
        146866,
        138295
      ],
      "opexCash": [
        166960,
        172022,
        170485,
        183740,
        206944,
        152400,
        179584,
        187766,
        193074,
        186832,
        182220,
        207824
      ],
      "capex": [
        0,
        0,
        0,
        0,
        0,
        0,
        0,
        0,
        0,
        0,
        0,
        0
      ],
      "loanDraw": [
        0,
        0,
        0,
        0,
        0,
        0,
        0,
        0,
        0,
        0,
        0,
        0